### ISSUE TITLE
Upgrading from HTTP 1.1 to Websockets fails under Jetty 12.1.6

### ISSUE THREAD

**Issue by kevrianate** [eclipse/jetty.project#14535]
**Jetty version(s)**
12.1.6

**Jetty Environment**
ee11

**HTTP version**
1.1

**Java version/vendor**
temurin-21.0.8+9.0.LTS

**OS type/version**
Windows 11 x64

**Description**
Our application starts with HTTP 1.1 but then upgrades to websockets. Under Jetty 12.1.5 the upgrade to websocket is ACKed and then communication continues via a websocket.  I found that after upgrading to Jetty 12.1.6 that Jetty ACKs the upgrade request but then never communicates via the websocket.  I then started working through all of the commit's to try to figure out which is causing the issue and found that a change contained in commit e9d4cba5a9d8ed62100bb09480af6fbb39c636cb causes the issue.  I have Wireshark captures for communication under both 12.1.5 and 12.1.6-SNAPSHOT commit e9d4cba5a9d8ed62100bb09480af6fbb39c636cb.

**How to reproduce?**
Upgrade an http 1.1 connection to websockets.

**Comment by sbordet** [comment]
How do you perform the upgrade from HTTP/1.1 to WebSocket? 

Are you using the Servlet APIs?
If so, we have tests for this case and they do not fail: https://github.com/jetty/jetty.project/blob/jetty-12.1.6/jetty-ee11/jetty-ee11-servlet/src/test/java/org/eclipse/jetty/ee11/servlet/ServletUpgradeTest.java

Is your application a client application that upgrades or a server application that upgrades?

I doubt that the commit you reference causes a problem in the WebSocket upgrade.

You may be hitting a corner case, so if you have a reproducible test case that we can try, that'll be great.

**Comment by kevrianate** [comment]
Its a standard Angular 19 server application with just a call to `new Websocket(path)`. 

I determined  the problematic commit by pulling the Jetty Github repo and working my way through the commits from 12.1.5 until I found the one that caused the websocket upgrade to fail.  

Jetty 12.1.6-SNAPSHOT commit 81b50d591d12ea08f2237ba990128c4535952d4f allows the upgrade to go through
Jetty 12.1.6-SNAPSHOT commit e9d4cba5a9d8ed62100bb09480af6fbb39c636cb doesnt.  

My testing methodology was to:

- Disable the maven cache in maven-build-cache-config.xml
- execute 'mvn clean install -DskipTests'
- Update maven dependencies, rebuild the application.
- Start my server, open Developer options in Chrome and refresh (F5) the UI.
- The console clearly showed that we were disconnected from the back end.

I then started Wireshark and ran the same set of tests to get WS logs in both the good (12.1.5) and bad case(1.2.6-SNAPSHOT).

**Comment by joakime** [comment]
Tested on Jetty 12.1.6 (released)
Using the example code from ...

https://github.com/jetty/jetty-examples/tree/12.1.x/embedded

There's 2 websocket server entry points tested ...

* [examples/browser/JakartaBrowserMain.java](https://github.com/jetty/jetty-examples/blob/12.1.x/embedded/ee10-websocket-jakarta-api/src/main/java/examples/browser/JakartaBrowserMain.java) from [embedded/ee10-websocket-jakarta-api](https://github.com/jetty/jetty-examples/tree/12.1.x/embedded/ee10-websocket-jakarta-api)
* [examples/time/WebSocketTimeServer.java](https://github.com/jetty/jetty-examples/blob/12.1.x/embedded/ee10-websocket-jetty-api/src/main/java/examples/time/WebSocketTimeServer.java) from https://github.com/jetty/jetty-examples/tree/12.1.x/embedded/ee10-websocket-jetty-api

Both run with the following JVMs ...

_Run 1:_
```
$ java --version
openjdk 17.0.15 2025-04-15
OpenJDK Runtime Environment Temurin-17.0.15+6 (build 17.0.15+6)
OpenJDK 64-Bit Server VM Temurin-17.0.15+6 (build 17.0.15+6, mixed mode, sharing)
```

_Run 2:_
```
$ java --version
openjdk 25.0.2 2026-01-20 LTS
OpenJDK Runtime Environment Temurin-25.0.2+10 (build 25.0.2+10-LTS)
OpenJDK 64-Bit Server VM Temurin-25.0.2+10 (build 25.0.2+10-LTS, mixed mode, sharing)
```

All 4 variations work as expected from the following browsers.

* Google Chrome - Version 145.0.7632.116 (Official Build) (64-bit)
* Firefox - 147.0.4 (64-bit)

At this point we will need a way to replicate the reported issue.
As the two major browsers work as expected.
We have tests that validate our implementation of the WebSocket behavior against the autobahn testsuite.

**Comment by kevrianate** [comment]
Do you have any tests for ee11 that I could validate my code against?  We are including:
```

<dependency>
	<groupId>org.eclipse.jetty.ee11.websocket</groupId>
	<artifactId>jetty-ee11-websocket-jakarta-server</artifactId>
</dependency>
```
Nevermind, I have the same problem when testing against ee10.

**Comment by harmanpa** [comment]
Same issue here, likewise with Angular 19:
* connections to Jetty 12.1.7 websocket fail
* connections to 12.1.5 successful

**Comment by harmanpa** [comment]
Also tested using Postman, which likewise cannot connect to 12.1.7 but can to 12.1.5

**Comment by kevrianate** [comment]
I just tested against 12.1.7 and the websocket upgrade still fails.

**Comment by joakime** [comment]
Tested against Jetty Release 12.1.7 with Chrome 145.0.7632.159 (Official Build) (64-bit)
And Firefox 148.0 (64-bit)

Using both of these as test-beds ...

* https://github.com/jetty/jetty-examples/tree/12.1.x/embedded/ee11-websocket-jakarta-api - the `examples.browser.JakartaBrowserMain` (Embedded Mode)
* The jetty-home standalone server with `ee11` modules and the same endpoints but as a war from https://github.com/jetty/jetty-examples/tree/12.1.x/webapps/jakarta-websocket-webapp (Standalone Mode)

_Setup of the jetty-home standalone server with war..._

```
[joakim@titan bases]$ mkdir ee11-websocket
[joakim@titan bases]$ cd ee11-websocket/
[joakim@titan ee11-websocket]$  java -jar ~/code/jetty/distros/jetty-home-12.1.7/start.jar --add-module=http,ee11-deploy,ee11-websocket-jakarta,ee11-webapp,ee11-annotations
INFO  : mkdir ${jetty.base}/start.d
INFO  : server          transitively enabled
INFO  : websocket-core-server transitively enabled
...(snip)...
INFO  : mkdir ${jetty.base}/webapps
INFO  : mkdir ${jetty.base}/environments
INFO  : Base directory was modified

[joakim@titan ee11-websocket]$ cp $HOME/.m2/repository/org/eclipse/jetty/examples/webapps/jakarta-websocket-webapp/12.1.x/jakarta-websocket-webapp-12.1.x.war webapps/root.war
[joakim@titan ee11-websocket]$ tree -F
./
├── environments/
├── resources/
│   └── jetty-logging.properties
├── start.d/
│   ├── bytebufferpool.ini
│   ├── deployer-standard.ini
│   ├── deployment-scanner.ini
│   ├── ee11-annotations.ini
│   ├── ee11-deploy.ini
│   ├── ee11-webapp.ini
│   ├── ee11-websocket-jakarta.ini
│   ├── ee-webapp.ini
│   ├── http-config.ini
│   ├── http.ini
│   ├── scheduler.ini
│   ├── server.ini
│   ├── sessions.ini
│   └── threadpool.ini
└── webapps/
    └── root.war

[joakim@titan ee11-websocket]$ java -jar ~/code/jetty/distros/jetty-home-12.1.7/start.jar 
2026-03-12 11:53:50.563:INFO :oejs.Server:main: jetty-12.1.7; built: 2026-03-04T00:34:02.020Z; git: 8e2e9db9edceef93d37a63814ed06b921eb7f23d; jvm 17.0.15+6
2026-03-12 11:53:50.571:INFO :oejd.DeploymentScanner:main: Deployment monitoring of [/home/joakim/code/jetty/distros/bases/ee11-websocket/webapps] at intervals 0s (hot-redeploy disabled)
2026-03-12 11:53:50.690:INFO :oeje11w.StandardDescriptorProcessor:main: NO JSP Support for /, did not find org.eclipse.jetty.ee11.jsp.JettyJspServlet
2026-03-12 11:53:50.720:INFO :oejsh.ContextHandler:main: Started oeje11w.WebAppContext@2584b82d{Test Jakarta WebSocket WebApp,/,b=file:///tmp/jetty-0_0_0_0-8080-root_war-_-any-7372674614414835341/webapp/,a=AVAILABLE,h=oeje11s.SessionHandler@4331d187{STARTED}}{file:///home/joakim/code/jetty/distros/bases/ee11-websocket/webapps/root.war}
2026-03-12 11:53:50.727:INFO :oeje11s.ServletContextHandler:main: Started oeje11w.WebAppContext@2584b82d{Test Jakarta WebSocket WebApp,/,b=file:///tmp/jetty-0_0_0_0-8080-root_war-_-any-7372674614414835341/webapp/,a=AVAILABLE,h=oeje11s.SessionHandler@4331d187{STARTED}}{file:///home/joakim/code/jetty/distros/bases/ee11-websocket/webapps/root.war}
2026-03-12 11:53:50.728:INFO :oejs.DefaultSessionIdManager:main: Session workerName=node0
2026-03-12 11:53:50.733:INFO :oejs.AbstractConnector:main: Started oejs.ServerConnector@32f232a5{HTTP/1.1, (http/1.1)}{0.0.0.0:8080}
2026-03-12 11:53:50.733:INFO :oejs.Server:main: Started oejs.Server@7dfd3c81{STARTING}[12.1.7,sto=0] @174ms
```

The ee11 `jakarta.websocket` layer works in all 4 scenarios ...

1. jetty embedded + firefox
2. jetty embedded + chrome
3. jetty standalone + firefox
4. jetty standalone + chrome

**Comment by joakime** [comment]
wscat works too. (tested against jetty standalone with war from jetty-examples - see above for setup)

```
$ wscat --version
5.2.0
$ wscat -s time -c ws://localhost:8080/time/ws
Connected (press CTRL+C to quit)
< 2026-03-12T17:28:41+0000
< 2026-03-12T17:28:42+0000
< 2026-03-12T17:28:43+0000
< 2026-03-12T17:28:44+0000
< 2026-03-12T17:28:45+0000
>
$ 
```

```
$ wscat -s tool -c ws://localhost:8080/demo/
Connected (press CTRL+C to quit)
> hello world
< hello world
> time:
< Server time: Thursday, March 12, 2026 at 12:30:57 PM Central Daylight Time
> many:40,20
< Many [fGzMkq}JvRMExvwpJHPbhg}Jt]t(upYy]bMJuJMo]
< Many [K|WtwcsSjgWxdkLZCXyRuzW]v|ZEVXr[VwwasX[A]
< Many [VMV-ohaBIMDnmnvEDnRzX]HIzkb)c(ifY][B:}qe]
< Many [DZuExzguchdqlzEWe-TnoWKoOaTMwCL:)f-XERYT]
< Many [PbmV{|KM]sxY|gKrZnEPENgO{tpPpEu]R}gD|IcZ]
< Many [(Ie(UCO:yh|fy|[:qmbgJDXMH]UK[wKPnzSxbMyT]
< Many [fMcIaBLXBAaYSwVpJI{{aVyu[ZkQzNnOUjywtOav]
< Many [Y:gSwCCn(HPfUmoCubuA[oqEdOf]}teINipJFwbM]
< Many [HhzFbuiXsSGtc]loRkfaHzsRumWDPnQa((:D[ZcY]
< Many [tWoEi|rtM)]jjbsNoqC)LupAMX|JXphjzfrw{vm[]
< Many [z)zv|tNFIJNYJFt)rAJWY{ep)-F)EuhWEwnNvYd)]
< Many [O){kbCTqargFvhVcBjLdcNUYcbmtFY}-}PnXQ{bA]
< Many [{W:O-VqEUYVMXVxBepGmilZGEPGHt[]nGf-k}-ig]
< Many [YQxAzU:{Uv-|e-)GndEKShVuJsR:Ln[-FevZnUK]]
< Many [VIhGxud{-W)AxUnlSP[FVMfz[PNxqccSHQ{(ZFsV]
< Many [DaRuGUJVrYa:(:bksNQ[SzSbdnJvLvc]}yKzQPZZ]
< Many [ygO(lQIFKrCQa)IHiekYxufxE}dNUS[BYWaDxqV-]
< Many [nNRJQHtVM:CkmDiKq:q)wSRvz[)jvjTaNRgp[thY]
< Many [SkDajePzE}yMaWNrhzUi}Mb(zbi)saTNCc|sSjTy]
< Many [GBIKvnBbC]XjsalIIjg))O(Am{SE]SOyci}kqjmU]
> info:
< Using jakarta.websocket
< Client has no User-Agent
< Client Sec-WebSocket-Extensions: permessage-deflate; client_max_window_bits
>
$ 
```

**Comment by joakime** [comment]
At this point we will need a reproduction example (a github repo and instructions on executing).
Don't use something like postman for these instructions, as postman requires a user account to function, and I *really* don't want to give yet another company my account details.

**Comment by kevrianate** [comment]
I will try to come up with a test case when I get a chance but the project Im on isnt leaving me much time for that.

**Comment by ctipper** [comment]
I can't produce a test case but +1 for this issue. Websocket upgrade fails using grizzly 5.0.0 jetty 12.1.6 and there are absolutely no diagnostics. All good in jetty 12.1.5

**Comment by lachlan-roberts** [comment]
I have reviewed the diff between 12.1.5 and 12.1.6 and I cannot see any plausible explanation for what could be causing this.

The changes to WebSocket code in this release were very minimal and would not have caused this.

The linked commit https://github.com/jetty/jetty.project/commit/e9d4cba5a9d8ed62100bb09480af6fbb39c636cb should only affect server during graceful shutdown so cannot be the cause.

Could you please capture some Jetty debug logs for the moment where the issue occurs so we can analyze.

**Comment by kevrianate** [comment]
My deleted comment was due to having attached a jetty log that had errors due to my application using **slf4j** which didnt work with jetty in debug logging.  I found that Jetty's websocket suddenly works in both 12.1.6 and 12.1.7 after updating to **slf4j2**.  This problem looks to be solved for me now and it might be worth @ctipper and @harmanpa to see if they are on slf4j and upgrade if possible to see if it fixes the issue for them as well.

**Comment by harmanpa** [comment]
@kevrianate Thank you, yes that is likely the problem on our side too

**Comment by sbordet** [comment]
Out of curiosity, how do you end up _not_ using SLF4J2?

I ask because as Jetty depends on SLF4J2, you must have explicitly excluded that dependency, and forced an older version of SLF4J.

Or is Jetty is a transitive dependency of another library that you use in your project, and this forced exclusion is done by this other library?

**Comment by ctipper** [comment]
I think this is a red-herring, sl4j2 dependency in my application makes no difference still not upgrading connection

**Comment by lachlan-roberts** [comment]
@ctipper are you able to collect some debug logs for the failure. Because we don't have enough info to investigate this further right now.

**Comment by ctipper** [comment]
That would be great but everything I've tried has failed it just stops. The only thing that produced output was the debug logger and it wasn't giving me anything I couldn't see from application logs. Claude was going around in circles.

**Comment by kevrianate** [comment]
> I think this is a red-herring, sl4j2 dependency in my application makes no difference still not upgrading connection

Its theoretically possible that its a red herring but we havent made any changes around how we use Jetty and I can cause the issue to reoccur if I just revert the one dependency back to a version which relied on SLF4J instead of SLF4J2.  The only differences in the 2 versions Im dealing with of that specific dependency are its dependencies (and minor code changes due to depedency updates).

We are now on Jetty 12.1.7 without any known issues.

**Comment by ctipper** [comment]
I can't make any progress on server side but I can verify that the handshake is completing, then connection gets reset, client disconnects. No changes to code, jetty 12.1.5 connects without errors.

FINE: > Session c984963d-990f-452b-a092-40dfb9edd9d8 [5 ms]: Sending handshake request:
> GET wss://metope.local:8443/fidget/fidosocket
> Authorization: *****
> Connection: Upgrade
> Host: metope.local:8443
> Origin: https://metope.local:8443
> Sec-WebSocket-Key: ml8XK1pJESHE5qyqR5w+iQ==
> Sec-WebSocket-Protocol: echo-protocol
> Sec-WebSocket-Version: 13
> Upgrade: websocket

Mar 19, 2026 2:40:29 PM org.glassfish.tyrus.core.DebugContext flush
FINE: < Session c984963d-990f-452b-a092-40dfb9edd9d8 [344 ms]: Received handshake response: 
< 101
< Connection: Upgrade
< Sec-WebSocket-Accept: AKBODsf4EBNpZXUyt+mduvhLAgo=
< Sec-WebSocket-Protocol: echo-protocol
< Server: Jetty(12.1.6)
< Upgrade: websocket

Mar 19, 2026 2:40:29 PM net.perspective.draw.fidget.client.FidgetClientEndpoint onOpen
INFO: Connected ... c984963d-990f-452b-a092-40dfb9edd9d8
Mar 19, 2026 2:40:29 PM org.glassfish.tyrus.core.DebugContext appendLogMessageWithThrowable
FINEST: > Session c984963d-990f-452b-a092-40dfb9edd9d8 [349 ms]: Sending object: 
Mar 19, 2026 2:40:29 PM net.perspective.draw.fidget.client.ByteEncoder init
FINEST: init
Mar 19, 2026 2:40:29 PM org.glassfish.tyrus.core.DebugContext appendLogMessageWithThrowable
FINEST: > Session c984963d-990f-452b-a092-40dfb9edd9d8 [350 ms]: Encoding with: CoderWrapper{coderClass=class net.perspective.draw.fidget.client.ByteEncoder, coder=null, type=class net.perspective.draw.fidget.client.Codex}
Mar 19, 2026 2:40:29 PM org.glassfish.tyrus.core.DebugContext appendLogMessageWithThrowable
FINE: * Session c984963d-990f-452b-a092-40dfb9edd9d8 [369 ms]: Incoming buffer size: 4194315
Mar 19, 2026 2:40:29 PM org.glassfish.tyrus.container.jdk.client.ClientFilter processError
SEVERE: Connection error has occurred
java.io.IOException: Connection reset

**Comment by sbordet** [comment]
@ctipper it would help if you detail how your system is set up.

We see the Tyrus logs, but are these on the client?

Is this ok: `Incoming buffer size: 4194315`? The buffer seems quite large?

Until we have the server logs, we cannot tell what going on.

How did you rule out this is a client-side problem?

**Comment by ctipper** [comment]
As I say I can't debug server I've spent about an an hour trying to get anything meaningful beyond existing logging. Close reason abnormal 1006 on server but not reliably reproducible. I guess if the code on client and server is not changed, and that the only way to produce error is by setting to use jetty 12.1.6 that would be my diagnostic.

Server side POM, excerpt
```
        <!-- Jetty test dependencies -->

        <dependency>
            <groupId>org.eclipse.jetty.ee10</groupId>
            <artifactId>jetty-ee10-webapp</artifactId>
            <version>${jetty.version}</version>
            <scope>test</scope>
        </dependency>

        <dependency>
            <groupId>org.eclipse.jetty.ee10</groupId>
            <artifactId>jetty-ee10-annotations</artifactId>
            <version>${jetty.version}</version>
            <scope>test</scope>
        </dependency>

        <dependency>
            <groupId>org.eclipse.jetty</groupId>
            <artifactId>jetty-security</artifactId>
            <version>${jetty.version}</version>
            <scope>test</scope>
        </dependency>        

        <dependency>
            <groupId>org.eclipse.jetty</groupId>
            <artifactId>jetty-slf4j-impl</artifactId>
            <version>${jetty.version}</version>
            <scope>test</scope>
        </dependency>

        <!-- Grizzly websockets -->

        <dependency>
            <groupId>org.glassfish.grizzly</groupId>
            <artifactId>grizzly-websockets</artifactId>
            <version>5.0.0</version>
            <scope>test</scope>
        </dependency>

        <!-- sl4j logging -->

        <dependency>
            <groupId>org.slf4j</groupId>
            <artifactId>slf4j-api</artifactId>
            <version>${slf4j.version}</version>
        </dependency>

        <!-- log4j logging -->

        <dependency>
            <groupId>org.apache.logging.log4j</groupId>
            <artifactId>log4j-core</artifactId>
            <version>${log4j.version}</version>
        </dependency>

        <dependency>
            <groupId>org.apache.logging.log4j</groupId>
            <artifactId>log4j-slf4j2-impl</artifactId>
            <version>${log4j.version}</version>
        </dependency>
```

**Comment by sbordet** [comment]
>  I guess if the code on client and server is not changed, and that the only way to produce error is by setting to use jetty 12.1.6 that would be my diagnostic.

You would not imagine how many times, in other cases, turned out to be another change that the reporter forgot, or was not even aware.

From your POM, you're using Grizzly websocket, so Jetty is not even in the picture for the WebSocket communication.

I'm all for helping you out, but so far, there is no Jetty on the client, no Jetty on the server, no server logs.
There is evidence that the WebSocket upgrade succeeds with a `101`, and past this point the communication is between Tyrus and Grizzly, with Jetty out of the picture.

You may be hitting a corner case, and if it's caused by Jetty we'll fix it, but so far there is no evidence it's even Jetty's fault.

Can you strip down your system to a reproducible case that we can try ourselves?

**Comment by ctipper** [comment]
I'm bailing out, this is exhausting me and I can't help you I'm not a pro just a hobby and if I can't get it to work I just won't upgrade. I can't produce a test case because I don't have a client that I can use and the server would take too long to setup. Close the issue if you want, I'll go back to my actual implementation on Payara and will remember not use my test harness.

I mean all I did was update `${jetty.version}`

**Comment by ctipper** [comment]
I was told by AI that I should downgrade to grizzly-websockets 4.0.2 to prevent noclassdef exceptions. I can confirm that this doesn't prevent the issue.

**Comment by sbordet** [comment]
@ctipper thanks for the additional information, but still not enough, sorry.

Since it's a test, is there no way for you to strip it down to the bare minimum, so that we can try to reproduce the issue ourselves?

**Comment by ctipper** [comment]
So is not a test it's a complex server app with a thick client. Stripping it down would give you something to test but wouldn't prove anything. If you know how to get more logging out of this I'm willing to try but it's defeated Gemini and Claude so I'm not optimistic.

**Comment by ctipper** [comment]
Also odd that you don't have any test suites

**Comment by olamy** [comment]
> Also odd that you don't have any test suites

Apparently, 103,949 tests across JDKs 17, 21, and 25 weren't quite enough to catch your issue. 
We are sorry. You can see our near-miss here:

 https://jenkins.webtide.net/job/jetty.project/job/jetty-12.1.x/lastCompletedBuild/testReport/

<img width="1655" height="562" alt="103,949 tests walked into a bar... and none of them saw this coming" src="https://github.com/user-attachments/assets/ff432dfa-74fd-465e-9e36-78f6fa80782f" />

Please note this is the total of tests running on 3 different jdk: 17, 21 and 25 (some are not running on some jdk, which explains the non-rounded 103949/3).

But if you see any tests missing, be assured we will be happy to accept your contribution to enrich the test suite with new cases we are sure to cover.

**Comment by lachlan-roberts** [comment]
You have two SLF4J providers in your pom.xml both `log4j-slf4j2-impl` and `jetty-slf4j-impl`, so this could be the reason you are not getting all the logs you expect. See https://jetty.org/docs/jetty/12.1/programming-guide/troubleshooting/logging.html

Jetty WebSocket does not seem to be used from what you have provided from your pom.xml

For us to investigate this we really just need some more information to look at.

It may also be helpful to do a Jetty Server Dump (see https://jetty.org/docs/jetty/12.1/operations-guide/troubleshooting/index.html#dump)

**Comment by ctipper** [comment]
This is a naive question but is it possible that this throws a null pointer exception that is uncaught https://github.com/jetty/jetty.project/commit/5eb0cf43e67959c55f6c69e77d49778f3a1d5bef#diff-b99b704800d89a9f21a5ab2e109db9139f6ce161f6478bcbe9b00dc3e3de5a58R60

**Comment by ctipper** [comment]
I don't use the above code path but I have noticed I use this in my onOpen handler `session.setMaxIdleTimeout(0L);` and there was some work in [Issue https://github.com/jetty/jetty.project/issues/9019 - improve configuration for Connector shutdownIdleTimeout](https://github.com/jetty/jetty.project/commit/a65e1bf5408a7ba518cc719e8d2d7a3acb4522d3) I notice that there is an open PR [Issue #14332 - fix idleTimeout bug after upgrading to WebSocket
#14648](https://github.com/jetty/jetty.project/pull/14648)

**Comment by sbordet** [comment]
> I use this in my onOpen handler session.setMaxIdleTimeout(0L);

Why?

What are you trying to achieve by setting the idle timeout to zero?

**Comment by sbordet** [comment]
@lachlan-roberts this is a bug.

The javadoc for WebSocket's `Session.setMaxIdleTimeout()` says:

> A value that is zero or negative indicates that this timeout will not be used.

But we forward the value of zero to `EndPoint` where it is interpreted as "close after 0 ms".

@ctipper can you please change your code to use `session.setMaxIdleTimeout(-1L);` and see if you still have the issue?

**Comment by ctipper** [comment]
Setting `session.setMaxIdleTimeout(-1L);` effects no change, still unexpected disconnect.

**Comment by lachlan-roberts** [comment]
@sbordet I don't think this is the case, the javadoc on `EndPoint.setIdleTimeout` says:
> idleTimeout – the idle timeout in MS. Timeout <= 0 implies an infinite timeout

So it should not be treating an idleTimeout of 0 as "close after 0ms".

**Comment by sbordet** [comment]
@lachlan-roberts you are right, I misread the `EndPoint/IdleTimeout` code. No bug here, sorry for the noise.

**Comment by lachlan-roberts** [comment]
> This is a naive question but is it possible that this throws a null pointer exception that is uncaught https://github.com/jetty/jetty.project/commit/5eb0cf43e67959c55f6c69e77d49778f3a1d5bef#diff-b99b704800d89a9f21a5ab2e109db9139f6ce161f6478bcbe9b00dc3e3de5a58R60

No, I don't see how a NPE would be possible from this change.

> I don't use the above code path but I have noticed I use this in my onOpen handler session.setMaxIdleTimeout(0L); and there was some work in [Issue https://github.com/jetty/jetty.project/issues/9019 - improve configuration for Connector shutdownIdleTimeout](https://github.com/jetty/jetty.project/commit/a65e1bf5408a7ba518cc719e8d2d7a3acb4522d3) I notice that there is an open PR Issue #14332 - fix idleTimeout bug after upgrading to WebSocket
#14648

The #9019 PR only affects the idleTimeout while doing a graceful shutdown after `server.stop()`. So does not apply to this situation.

And #14648 is to fix an issue where the idleTimeout is being reverted to the HTTP value after the upgrade under certain conditions. You are using the `Session.setIdleTimeout` so this bug will not affect you.

For now I would just focus on getting the jetty debug logs working.

**Comment by ctipper** [comment]
I had a good long session with Claude this am and it eventually clocked that authentication servlet was seizing web app context and all internal logging was being swallowed. I can't fix that and neither could Claude, so you might as well mark this as WONTFIX

**Comment by sbordet** [comment]
@ctipper what does "clocked that authentication servlet was seizing web app context and all internal logging was being swallowed" mean in plain English? (sorry, I'm not a native English speaker)

**Comment by ctipper** [comment]
I couldn't get past this:
> Log4j2 is initialising from your webapp classloader (oejew.WebAppClassLoader{/fidget}), not the Jetty/Maven classloader. So it creates a LoggerContext scoped to your webapp — and Jetty's own classes are in a completely different classloader and get a different context that has no configuration.
> This is the fundamental classloader isolation problem in Jetty. Your webapp and Jetty itself are in separate classloaders and Log4j2 creates separate contexts for each.

**Comment by joakime** [comment]
> I couldn't get past this:
> 
> > Log4j2 is initialising from your webapp classloader (oejew.WebAppClassLoader{/fidget}), not the Jetty/Maven classloader. So it creates a LoggerContext scoped to your webapp — and Jetty's own classes are in a completely different classloader and get a different context that has no configuration.
> > This is the fundamental classloader isolation problem in Jetty. Your webapp and Jetty itself are in separate classloaders and Log4j2 creates separate contexts for each.

It's even more pernicious then you think.
Maven comes with slf4j (and depending on your maven version, that slf4j-api can be quite old).
If an older version of slf4j-api is initialized when Maven starts, then the auto-discovery of implementations (your log4j2) isn't working properly when the jetty-maven-plugin roles around to execute.

See this for more details https://github.com/jetty/jetty.project/issues/14435 

Try switching to [a forked deployment mode on jetty-maven-plugin](https://jetty.org/docs/jetty/12.1/programming-guide/maven-jetty/jetty-maven-plugin.html#forked), that should help with your classloader issues.

**Comment by ctipper** [comment]
I put my app in cowork and it set up logging so there were no conflicts and used `deployMode=FORK`. It got it to run effectively for the first time, still no trace logging but nevermind. I copy below it's analysis it's better than my summary, I think this issue was a complex failure that doesn't require any work.

> Good to hear it's running. Here's what I think was happening.
>
> In the non-FORK (EMBED) mode, Jetty runs your webapp in an isolated classloader while Jetty's own server threads live in the parent classloader. The WebSocket lifecycle crosses that boundary constantly — Jetty's I/O threads handle the initial HTTP upgrade, then continue to read and write WebSocket frames, dispatching into your Tyrus/Grizzly endpoints in the webapp classloader.
>
> The thread context classloader (TCCL) on those I/O threads needs to be the webapp classloader for Tyrus to find its own classes and your endpoint classes. But in EMBED mode, the TCCL isn't always set correctly when Jetty's threads cross back into server-level code for things like idle timeout checks, connection management, or flow control callbacks. If Tyrus or Grizzly tries to load a class, deserialise a frame, or look up a resource at one of those moments when the TCCL is the server classloader rather than the webapp classloader, it throws an exception — and that exception kills the connection.
The "random" part fits because it's a race condition. The disconnect only happens when a frame or a keepalive coincides with the TCCL being wrong, which depends on thread scheduling and traffic timing.
>
> On top of that, the split logging context meant these failures were completely invisible. Jetty's server-side code was logging to jetty-slf4j-impl (or, as we saw, to NOP), while your Log4j2 configuration only covered the webapp classloader. So any ClassNotFoundException, NoClassDefFoundError, or Tyrus internal error on the server side was silently swallowed. The connection would just drop with no trace in your logs.
>
> FORK mode fixes both problems at once: the entire JVM shares one classpath, so there's no classloader boundary for threads to stumble across, and Log4j2 is the single SLF4J provider for everything — Jetty, Tyrus, Grizzly, and your application code. Any error that does occur will now actually show up in your logs.

**Comment by jsharkey13** [comment]
We have been having the same problem. We are trying to upgrade from Jetty 11 to Jetty 12. We have previously upgraded our project from Jetty 9 to 10 and later 10 to 11.

WebSockets no longer work in Jetty `12.1.7`, and my colleagues and I have spent several days trying several potential fixes before I stumbled upon this issue. We have seen exactly the behaviour described in the comments above; the server sends a TCP FIN ACK immediately after the 101 Switching Protocols and no WebSocket is established. The constructor of the WebSocket class _is_ called, but the `@OnWebSocketOpen` method is not. 
We are using `jetty-ee10-maven-plugin` for local development, and it seems that the plugin is the primary factor in the issue here.

Downgrading to `12.1.5` immediately fixes the problem. WebSockets work as they did in Jetty 11, 10 and 9.

In the process of trying to eliminate every possible factor, we made a minimal working example using the [example Jetty code](https://github.com/jetty/jetty-examples/tree/12.0.x/embedded/ee10-websocket-jetty-api) most similar to our application. We can reproduce the bug with just four files and a simple `pom.xml`. Building a WAR file from this minimal example and deploying it to Jetty `12.1.7` in Docker _does_ have working WebSockets, which suggests to me that the problem is a change to the Maven plugin. We then checked our main application, and that does work when deployed as a WAR file but not when using the plugin locally.

---
 Minimal (not-)working example:

`pom.xml`
```xml
<?xml version="1.0" encoding="UTF-8"?>
<project xmlns="http://maven.apache.org/POM/4.0.0"
         xmlns:xsi="http://www.w3.org/2001/XMLSchema-instance"
         xsi:schemaLocation="http://maven.apache.org/POM/4.0.0 http://maven.apache.org/xsd/maven-4.0.0.xsd">
    <modelVersion>4.0.0</modelVersion>

    <groupId>org.example</groupId>
    <artifactId>jetty-websocket-bug</artifactId>
    <version>0.1</version>
    <packaging>war</packaging>

    <properties>
        <maven.compiler.source>21</maven.compiler.source>
        <maven.compiler.target>21</maven.compiler.target>
        <project.build.sourceEncoding>UTF-8</project.build.sourceEncoding>
        <jetty.port>8080</jetty.port>
        <!-- Does not work, nor does 12.1.6! -->
        <jetty.version>12.1.7</jetty.version>
        <!-- Works exactly as expected! -->
        <!--<jetty.version>12.1.5</jetty.version>-->
    </properties>

    <repositories>
        <repository>
            <id>central</id>
            <name>Maven Central</name>
            <url>https://repo1.maven.org/maven2/</url>
        </repository>
    </repositories>
    <dependencyManagement>
        <dependencies>
            <dependency>
                <groupId>org.eclipse.jetty</groupId>
                <artifactId>jetty-bom</artifactId>
                <version>${jetty.version}</version>
                <type>pom</type>
                <scope>import</scope>
            </dependency>
            <dependency>
                <groupId>org.eclipse.jetty.ee10</groupId>
                <artifactId>jetty-ee10-bom</artifactId>
                <version>${jetty.version}</version>
                <type>pom</type>
                <scope>import</scope>
            </dependency>
        </dependencies>
    </dependencyManagement>

    <dependencies>
        <dependency>
            <groupId>org.eclipse.jetty.ee10.websocket</groupId>
            <artifactId>jetty-ee10-websocket-jetty-server</artifactId>
        </dependency>

        <dependency>
            <groupId>org.eclipse.jetty.websocket</groupId>
            <artifactId>jetty-websocket-jetty-client</artifactId>
        </dependency>
    </dependencies>

    <build>
        <plugins>
            <plugin>
                <groupId>org.apache.maven.plugins</groupId>
                <artifactId>maven-war-plugin</artifactId>
                <version>3.2.3</version>
                <configuration>
                    <webXml>${basedir}/web.xml</webXml>
                </configuration>
            </plugin>
            <plugin>
                <groupId>org.eclipse.jetty.ee10</groupId>
                <artifactId>jetty-ee10-maven-plugin</artifactId>
                <version>${jetty.version}</version>
                <configuration>
                    <webApp>
                        <contextPath>/*</contextPath>
                        <overrideDescriptor>web.xml</overrideDescriptor>
                        <webInfIncludeJarPattern>^$</webInfIncludeJarPattern>
                        <containerIncludeJarPattern>^$</containerIncludeJarPattern>
                    </webApp>
                    <httpConnector>
                        <port>${jetty.port}</port>
                    </httpConnector>
                </configuration>
            </plugin>
        </plugins>
    </build>
</project>
```

`web.xml`
```xml
<?xml version="1.0" encoding="UTF-8"?>
<web-app xmlns="http://java.sun.com/xml/ns/j2ee" version="3.0">
    <servlet>
        <servlet-name>Echo</servlet-name>
        <servlet-class>org.example.EchoWebSocketServlet</servlet-class>
        <load-on-startup>1</load-on-startup>
    </servlet>
    <servlet-mapping>
        <servlet-name>Echo</servlet-name>
        <url-pattern>/echo</url-pattern>
    </servlet-mapping>
</web-app>
```

`src/main/java/org/example/EchoWebSocketServlet.java`
```java
package org.example;

import org.eclipse.jetty.ee10.websocket.server.JettyWebSocketServlet;
import org.eclipse.jetty.ee10.websocket.server.JettyWebSocketServletFactory;

public class EchoWebSocketServlet extends JettyWebSocketServlet {
    @Override
    public void configure(JettyWebSocketServletFactory factory) {
        System.out.println("Configuring EchoWebSocketServlet");
        factory.register(EchoWebSocket.class);
    }
}
```

`src/main/java/org/example/EchoWebSocket.java`
```java
package org.example;

import org.eclipse.jetty.websocket.api.Callback;
import org.eclipse.jetty.websocket.api.Session;
import org.eclipse.jetty.websocket.api.annotations.*;

@WebSocket
public class EchoWebSocket {
    private Session session;

    public EchoWebSocket() {
        System.out.println("WebSocket Constructed");
    }

    @OnWebSocketOpen
    public void onWebSocketOpen(Session session) {
        this.session = session;
        System.out.println("WebSocket Open: " + session);
        this.session.sendText("You are now connected to " + this.getClass().getName(), Callback.NOOP);
    }

    @OnWebSocketClose
    public void onWebSocketClose(int statusCode, String reason) {
        this.session = null;
        System.out.println("WebSocket Close: " + statusCode + " - " + reason);
    }

    @OnWebSocketError
    public void onWebSocketError(Throwable cause) {
        System.out.println("WebSocket Error: " + cause.getMessage());
    }

    @OnWebSocketMessage
    public void onWebSocketText(String message) {
        System.out.println("Echoing back text message [" + message + "]");
        this.session.sendText(message, Callback.NOOP);
    }
}
```

Running `mvn jetty:run` with the configuration as above and then connecting to `ws://localhost:8080/echo` prints `WebSocket Constructed` to the server output, gets a 101 Switching Protocols in the browser, but never `WebSocket Open: ...` and no frames are sent to the client before the FIN ACK.
Swapping the `<jetty.version>` line to the commented `12.1.5` line and running `jetty:run`, the WebSocket immediately connects and both the `WebSocket Constructed` and `WebSocket Open: ...` lines are printed.

Wireshark confirms that after the 101 Switching Protocols, Jetty `12.1.7` immediately terminates the connection:
```
No. Time      Src  Dst  Prot  Len  Info
1   0.902219  ::1  ::1  TCP   76   53322 → 8080 [SYN] Seq=0 Win=65535 Len=0 MSS=65475 WS=256 SACK_PERM
2   0.902329  ::1  ::1  TCP   76   8080 → 53322 [SYN, ACK] Seq=0 Ack=1 Win=65535 Len=0 MSS=65475 WS=256 SACK_PERM
3   0.902393  ::1  ::1  TCP   64   53322 → 8080 [ACK] Seq=1 Ack=1 Win=65280 Len=0
4   0.902813  ::1  ::1  HTTP  881  GET /echo HTTP/1.1 
5   0.902848  ::1  ::1  TCP   64   8080 → 53322 [ACK] Seq=1 Ack=818 Win=64512 Len=0
6   0.999244  ::1  ::1  HTTP  299  HTTP/1.1 101 Switching Protocols 
7   0.999289  ::1  ::1  TCP   64   53322 → 8080 [ACK] Seq=818 Ack=236 Win=65280 Len=0
8   1.003557  ::1  ::1  TCP   64   8080 → 53322 [FIN, ACK] Seq=236 Ack=818 Win=64512 Len=0
9   1.003597  ::1  ::1  TCP   64   53322 → 8080 [ACK] Seq=818 Ack=237 Win=65280 Len=0
10  1.003749  ::1  ::1  TCP   64   53322 → 8080 [FIN, ACK] Seq=818 Ack=237 Win=65280 Len=0
11  1.003788  ::1  ::1  TCP   64   8080 → 53322 [ACK] Seq=237 Ack=819 Win=64512 Len=0
```
i.e. there's an ACK from the browser (port 53322) for the HTTP 101 (packet 7), but then immediately FIN ACK from Jetty (packet 8). No WebSocket frames are exchanged.

---
Further information:

It did not matter which browser we tried to use for the WebSocket client (and we confirmed it using the [Jetty example WebSocket client](https://github.com/jetty/jetty-examples/blob/12.0.x/embedded/ee10-websocket-jetty-api/src/main/java/examples/annotated/EchoClient.java) too).

Using `mvn package` to produce a WAR file and deploying it in Docker using the `jetty:12.1.7-jdk21-eclipse-temurin` image works exactly as expected, so this seems related to either the container vs application classpath stuff, or else is a problem in the plugin itself.

Trying the two dependencies as `<scope>provided</scope>` and `<useProvidedScope>true</useProvidedScope>` for the plugin does not fix the problem. Putting the dependencies inside the `<plugin>` in `pom.xml` also does not fix the problem.

The example above does not use any logging frameworks not included in the Jetty BOMs (I used `System.out.println` to be sure that the logging was not the problem; unless the logging problem is _internal_ to Jetty), so it seems unlikely to be an SLF4J problem.

Version `12.1.6` has broken WebSockets with the example above, as expected from the earlier comments.
Switching everything to use `ee11` does not fix it either (but `12.1.5` does work perfectly with EE11 too).

I didn't have much success getting Jetty debug logging working, but I am hoping that this example is so simple and quick to run that someone who knows how to debug Jetty will be able to.

---

Please let me know if there is any more information I can provide. This example is lifted almost verbatim from the Jetty documentation, the only changes being to use `jetty-ee10-maven-plugin` and remove the logging framework, so I would expect this to be a valid use-case.

**Comment by joakime** [comment]
As pointed out in https://github.com/jetty/jetty.project/issues/14535#issuecomment-4103210547
Both Maven and Jetty use slf4j.
Your version of Maven can result in an slf4j version incompatibility, which will break things in Jetty (and other components that use slf4j versions newer than maven)

To get around this, use [the fork deploy mode in jetty-ee10-maven-plugin](https://jetty.org/docs/jetty/12.1/programming-guide/maven-jetty/jetty-maven-plugin.html#forked), or upgrade to Maven 4.x.

``` xml
            <plugin>
                <groupId>org.eclipse.jetty.ee10</groupId>
                <artifactId>jetty-ee10-maven-plugin</artifactId>
                <version>${jetty.version}</version>
                <configuration>
                    <deployMode>FORK</deployMode> <!-- THIS LINE -->
                    <webApp>
                        <contextPath>/*</contextPath>
                        <overrideDescriptor>web.xml</overrideDescriptor>
                        <webInfIncludeJarPattern>^$</webInfIncludeJarPattern>
                        <containerIncludeJarPattern>^$</containerIncludeJarPattern>
                    </webApp>
                    <httpConnector>
                        <port>${jetty.port}</port>
                    </httpConnector>
                </configuration>
            </plugin>
```

**Comment by jsharkey13** [comment]
Ah, sorry, I misunderstood that comment as only being about the logging library versions specified in `pom.xml`. But you mean that `jetty-ee10-maven-plugin` since `12.1.6` is no longer compatible with Maven 3.x, except in `FORK` or `EXTERNAL` mode, because Maven 3.x bundles slf4j 1.x itself?

Maven 4 is still a release candidate, and the Apache page says it's for preview testing not for production use. But as you suggest, the above example works fine as-is for me with Maven `4.0.0-rc-5` using Jetty `12.1.7`. I suppose since it's local development only for us (and the plugin is not for production use anyhow), moving to Maven 4 locally isn't so much of an issue!

It does also work in `FORK` mode (with `<deployMode>FORK</deployMode>` under `<configuration>` not inside `<webApp>`) with Maven `3.9.11` - but IntelliJ struggles to terminate the forked process and attaching a debugger is painful, so this would be an awkward migration for our local development use-case.

I found a third option, too, since you pointed out it was Maven providing the problematic version of slf4j. As noted in [the Maven logging documentation](https://maven.apache.org/maven-logging.html#changing-the-slf4j-implementation), replacing the `slf4j-api-1.7.XXX.jar` with a `slf4j-api-2.0.XXX.jar` in the `lib` directory inside the Maven Home directory swaps the logging implementation Maven uses. This also fixes the WebSocket problem in the example above (but I haven't exhaustively checked it hasn't broken anything else in Maven - the page details how to change the _implementation_ JAR, not the API itself!).

Thank you for the suggestions!

---

Would it be possible to document somewhere that from `12.1.6`, using Maven 3.x is incompatible with `jetty-ee{8,9,10,11}-maven-plugin` without changes to the default config or to the Maven setup? I see from 14435 that this isn't the only issue the logging provider clash is causing. (Though maybe it's actually Jetty 12.x that's incompatible, and it's just chance that it took until `12.1.6` for anything truly incompatible to be added!).
We had checked the [Jetty Maven Plugin documentation](https://jetty.org/docs/jetty/12.1/programming-guide/maven-jetty/jetty-maven-plugin.html), and the migration guides we used for [11.0.x -> 12.0.x](https://jetty.org/docs/jetty/12.1/programming-guide/migration/11-to-12.html) and [12.0.x -> 12.1.x](https://jetty.org/docs/jetty/12.1/programming-guide/migration/12.0-to-12.1.html) don't mention anything either.

**Comment by sbordet** [comment]
We need to understand exactly what the problem is with SLF4J.

The use of the "fluent" API from SLF4J2 that we do in Jetty has been introduced in 12.1.4, but everybody reports that 12.1.5 works fine.

Furthermore, the "fluent" API is always behind the `isDebugEnabled()` guard, so it will not be called unless running with DEBUG level; and if it is not called, it won't generate errors.

So it is something else, and we need to understand what exactly.

I'll try to set up what @jsharkey13 reported above, and see if I can reproduce.

**Comment by jsharkey13** [comment]
Thanks! It looks to me like #14567 (and perhaps 14695 too) is the same issue as this.
There was a PR there (#14568) to fix a usage of an SLF4J2 fluent method call that is not behind `isDebugEnabled()`. That didn't get merged due to a CLA issue.

If I put a debugger breakpoint [on that problematic line](https://github.com/jetty/jetty.project/blob/jetty-12.1.7/jetty-core/jetty-server/src/main/java/org/eclipse/jetty/server/internal/HttpChannelState.java#L723), _every_ request I make to Jetty (including those that succeed like the directory listing `http://localhost:8080`) immediately throws an error `java.lang.NoSuchMethodError: 'org.slf4j.spi.LoggingEventBuilder org.slf4j.Logger.atDebug()`. I am not clear why the HTTP ones succeed where the WebSocket ones don't, but it does seem to be suspicious. (Maybe `stream.succeeded()` not being called is the problem in 14695?).

(When I swap out the Maven `lib` `slf4j-api-1.7.XXX.jar` JAR for the v2 JAR, that line then succeeds and the WebSocket connects; it's not quite proof that it is the problem, since I cannot _skip_ execution just of that line with the old JAR, but it does seem like a good first thing to try if you can reproduce the issue).

**Comment by sbordet** [comment]
@jsharkey13 it is indeed naked calls to `atDebug()` not protected by `isDebugEnabled()` 😭 

I'm now running at extensive grep through the code to eliminate all such occurrences.

Fixing the `HttpChannelState` one makes your reproducer work, but I'll try to find all of them.
Thanks for the simple reproducer!

We'll discuss whether to revert the usage of the fluent APIs, given that Maven still ships 1.7.x and does not isolate plugins.

**Comment by sbordet** [comment]
We had to give up -- 2026 and still cannot use SLF4J 2.x features as too many are still on SLF4J 1.x.

Closing this issue, will be resolved by #14747.
